energy/data/synthetic_fp32_cache_NVIDIA_A100-PCIE-40GB.json
{
"device_name": "NVIDIA A100-PCIE-40GB",
"kernel_name": "fp32_kernel",
"problem_size": [
108,
64
],
"tune_params_keys": [
"block_size_x",
"nr_outer",
"nr_inner",
"nvml_gr_clock"
],
"tune_params": {
"block_size_x": [
1024
],
"nr_outer": [
64
],
"nr_inner": [
1024
],
"nvml_gr_clock": [
1410,
1395,
1380,
1365,
1350,
1335,
1320,
1305,
1290,
1275,
1260,
1245,
1230,
1215,
1200,
1185,
1170,
1155,
1140,
1125,
1110,
1095,
1080,
1065,
1050,
1035,
1020,
1005,
990,
975,
960,
945,
930,
915,
900,
885,
870,
855,
840,
825,
810,
795,
780,
765,
750,
735,
720,
705,
690,
675,
660,
645,
630,
615,
600,
585,
570,
555,
540,
525,
510,
495,
480,
465,
450,
435,
420,
405,
390,
375,
360,
345,
330,
315,
300,
285,
270,
255,
240,
225,
210
]
},
"objective": "time",
"cache": {
"1024,64,1024,1410": {"block_size_x": 1024, "nr_outer": 64, "nr_inner": 1024, "nvml_gr_clock": 1410, "core_freq": 1410.0, "time": 196.36909942626954, "times": [196.51686096191406, 196.32127380371094, 196.37452697753906, 196.38169860839844, 196.34585571289062, 196.25062561035156, 196.384765625, 196.40524291992188, 196.3345947265625, 196.37554931640625], "pwr_core_freq": 1410.0, "nvml_power": 153.601, "compile_time": 4065.216358983889, "verification_time": 0, "benchmark_time": 3151.2722801417112, "f": 1410.0, "strategy_time": 0, "framework_time": 3.915314096957445, "timestamp": "2023-04-17 11:57:40.086491+00:00"},
"1024,64,1024,1395": {"block_size_x": 1024, "nr_outer": 64, "nr_inner": 1024, "nvml_gr_clock": 1395, "core_freq": 1395.0, "time": 198.9186538696289, "times": [199.14137268066406, 198.77069091796875, 199.00314331054688, 198.98367309570312, 198.7573699951172, 198.9171142578125, 198.88844299316406, 198.9171142578125, 198.9785614013672, 198.8290557861328], "pwr_core_freq": 1395.0, "nvml_power": 147.924, "compile_time": 4098.890153924003, "verification_time": 0, "benchmark_time": 3641.1447289865464, "f": 1395.0, "strategy_time": 0, "framework_time": 1.8296882044523954, "timestamp": "2023-04-17 11:57:47.828398+00:00"},
"1024,64,1024,1380": {"block_size_x": 1024, "nr_outer": 64, "nr_inner": 1024, "nvml_gr_clock": 1380, "core_freq": 1380.0, "time": 200.50524291992187, "times": [200.8053741455078, 200.32205200195312, 200.39578247070312, 200.47975158691406, 200.5166015625, 200.56166076660156, 200.49305725097656, 200.62002563476562, 200.35891723632812, 200.49920654296875], "pwr_core_freq": 1380.0, "nvml_power": 143.461, "compile_time": 4079.3236170429736, "verification_time": 0, "benchmark_time": 3407.6177459210157, "f": 1380.0, "strategy_time": 0, "framework_time": 1.6936829779297113, "timestamp": "2023-04-17 11:57:55.317075+00:00"},
"1024,64,1024,1365": {"block_size_x": 1024, "nr_outer": 64, "nr_inner": 1024, "nvml_gr_clock": 1365, "core_freq": 1365.0, "time": 203.1915023803711, "times": [204.1651153564453, 203.114501953125, 203.21792602539062, 203.15032958984375, 203.11654663085938, 203.0960693359375, 202.94143676757812, 203.0049285888672, 203.0397491455078, 203.06842041015625], "pwr_core_freq": 1365.0, "nvml_power": 137.88, "compile_time": 4081.172219943255, "verification_time": 0, "benchmark_time": 3455.1102288533, "f": 1365.0, "strategy_time": 0, "framework_time": 1.9215100910514593, "timestamp": "2023-04-17 11:58:02.855322+00:00"},
"1024,64,1024,1350": {"block_size_x": 1024, "nr_outer": 64, "nr_inner": 1024, "nvml_gr_clock": 1350, "core_freq": 1350.0, "time": 205.10637969970702, "times": [204.7580108642578, 205.27923583984375, 205.06419372558594, 205.11538696289062, 205.1092529296875, 205.1420135498047, 205.21983337402344, 205.13381958007812, 205.07545471191406, 205.16659545898438], "pwr_core_freq": 1350.0, "nvml_power": 134.936, "compile_time": 4101.596600143239, "verification_time": 0, "benchmark_time": 3480.5461128707975, "f": 1350.0, "strategy_time": 0, "framework_time": 1.865094993263483, "timestamp": "2023-04-17 11:58:10.439371+00:00"},
"1024,64,1024,1335": {"block_size_x": 1024, "nr_outer": 64, "nr_inner": 1024, "nvml_gr_clock": 1335, "core_freq": 1335.0, "time": 207.6596221923828, "times": [207.994873046875, 207.5740203857422, 207.63136291503906, 207.5801544189453, 207.75424194335938, 207.65081787109375, 207.59449768066406, 207.5863037109375, 207.56991577148438, 207.6600341796875], "pwr_core_freq": 1335.0, "nvml_power": 129.719, "compile_time": 4071.461586980149, "verification_time": 0, "benchmark_time": 3514.281533192843, "f": 1335.0, "strategy_time": 0, "framework_time": 1.6821427270770073, "timestamp": "2023-04-17 11:58:18.026836+00:00"},
"1024,64,1024,1320": {"block_size_x": 1024, "nr_outer": 64, "nr_inner": 1024, "nvml_gr_clock": 1320, "core_freq": 1320.0, "time": 210.20651550292968, "times": [210.25587463378906, 210.28147888183594, 210.4145965576172, 210.05516052246094, 210.28965759277344, 210.08998107910156, 210.13401794433594, 210.14938354492188, 210.16677856445312, 210.2282257080078], "pwr_core_freq": 1320.0, "nvml_power": 126.69, "compile_time": 4085.648023057729, "verification_time": 0, "benchmark_time": 3557.7373541891575, "f": 1320.0, "strategy_time": 0, "framework_time": 1.4860157389193773, "timestamp": "2023-04-17 11:58:25.671755+00:00"},
"1024,64,1024,1305": {"block_size_x": 1024, "nr_outer": 64, "nr_inner": 1024, "nvml_gr_clock": 1305, "core_freq": 1305.0, "time": 211.64963989257814, "times": [211.957763671875, 211.49798583984375, 211.72019958496094, 211.54202270507812, 211.62803649902344, 211.64236450195312, 211.66796875, 211.6874237060547, 211.5583953857422, 211.59423828125], "pwr_core_freq": 1305.0, "nvml_power": 122.745, "compile_time": 4068.175507010892, "verification_time": 0, "benchmark_time": 3586.611932143569, "f": 1305.0, "strategy_time": 0, "framework_time": 1.6688588075339794, "timestamp": "2023-04-17 11:58:33.328253+00:00"},
"1024,64,1024,1290": {"block_size_x": 1024, "nr_outer": 64, "nr_inner": 1024, "nvml_gr_clock": 1290, "core_freq": 1290.0, "time": 214.18895568847657, "times": [214.37030029296875, 214.17779541015625, 214.1685791015625, 214.10610961914062, 214.19418334960938, 214.16653442382812, 214.11123657226562, 214.26585388183594, 214.15219116210938, 214.17677307128906], "pwr_core_freq": 1290.0, "nvml_power": 119.905, "compile_time": 4079.7580680809915, "verification_time": 0, "benchmark_time": 3601.5685368329287, "f": 1290.0, "strategy_time": 0, "framework_time": 1.8000330310314894, "timestamp": "2023-04-17 11:58:41.011419+00:00"},
"1024,64,1024,1275": {"block_size_x": 1024, "nr_outer": 64, "nr_inner": 1024, "nvml_gr_clock": 1275, "core_freq": 1275.0, "time": 216.6697998046875, "times": [217.0654754638672, 216.6517791748047, 216.62208557128906, 216.56883239746094, 216.61798095703125, 216.6814727783203, 216.6138916015625, 216.62310791015625, 216.5401611328125, 216.7132110595703], "pwr_core_freq": 1275.0, "nvml_power": 117.048, "compile_time": 4085.879103979096, "verification_time": 0, "benchmark_time": 3645.3602460678667, "f": 1275.0, "strategy_time": 0, "framework_time": 1.6208069864660501, "timestamp": "2023-04-17 11:58:48.744321+00:00"},
"1024,64,1024,1260": {"block_size_x": 1024, "nr_outer": 64, "nr_inner": 1024, "nvml_gr_clock": 1260, "core_freq": 1260.0, "time": 219.89795837402343, "times": [221.16864013671875, 219.67462158203125, 219.75347900390625, 219.6961212158203, 219.82412719726562, 219.71148681640625, 219.71250915527344, 219.82003784179688, 219.7626953125, 219.85586547851562], "pwr_core_freq": 1260.0, "nvml_power": 112.463, "compile_time": 4053.230084013194, "verification_time": 0, "benchmark_time": 3688.0595029797405, "f": 1260.0, "strategy_time": 0, "framework_time": 1.8127469811588526, "timestamp": "2023-04-17 11:58:56.487463+00:00"},
"1024,64,1024,1245": {"block_size_x": 1024, "nr_outer": 64, "nr_inner": 1024, "nvml_gr_clock": 1245, "core_freq": 1245.0, "time": 222.3494140625, "times": [222.55821228027344, 222.13119506835938, 222.23257446289062, 222.271484375, 222.37184143066406, 222.24794006347656, 222.39231872558594, 222.5233917236328, 222.382080078125, 222.3831024169922], "pwr_core_freq": 1245.0, "nvml_power": 109.816, "compile_time": 4073.3100809156895, "verification_time": 0, "benchmark_time": 3732.5094509869814, "f": 1245.0, "strategy_time": 0, "framework_time": 1.3853192795068026, "timestamp": "2023-04-17 11:59:04.294708+00:00"},
"1024,64,1024,1230": {"block_size_x": 1024, "nr_outer": 64, "nr_inner": 1024, "nvml_gr_clock": 1230, "core_freq": 1230.0, "time": 224.94423217773436, "times": [225.8882598876953, 224.6543426513672, 224.83558654785156, 224.89804077148438, 224.974853515625, 224.65945434570312, 224.89088439941406, 225.00863647460938, 224.90931701660156, 224.7229461669922], "pwr_core_freq": 1230.0, "nvml_power": 107.425, "compile_time": 4067.300232825801, "verification_time": 0, "benchmark_time": 3772.424397058785, "f": 1230.0, "strategy_time": 0, "framework_time": 1.629444072023034, "timestamp": "2023-04-17 11:59:12.136109+00:00"},
"1024,64,1024,1215": {"block_size_x": 1024, "nr_outer": 64, "nr_inner": 1024, "nvml_gr_clock": 1215, "core_freq": 1215.0, "time": 227.42947845458986, "times": [228.0642547607422, 228.39500427246094, 227.23788452148438, 228.9950714111328, 226.9501495361328, 226.83648681640625, 226.99929809570312, 226.9890594482422, 226.9839324951172, 226.84364318847656], "pwr_core_freq": 1215.0, "nvml_power": 105.465, "compile_time": 4071.404770947993, "verification_time": 0, "benchmark_time": 3807.1786710061133, "f": 1215.0, "strategy_time": 0, "framework_time": 1.3076032046228647, "timestamp": "2023-04-17 11:59:20.016039+00:00"},
"1024,64,1024,1200": {"block_size_x": 1024, "nr_outer": 64, "nr_inner": 1024, "nvml_gr_clock": 1200, "core_freq": 1200.0, "time": 230.07191009521483, "times": [231.09324645996094, 229.94329833984375, 229.9166717529297, 229.9904022216797, 229.93817138671875, 229.99449157714844, 229.8798065185547, 229.98118591308594, 229.98016357421875, 230.0016632080078], "pwr_core_freq": 1200.0, "nvml_power": 103.009, "compile_time": 4070.7707370165735, "verification_time": 0, "benchmark_time": 3848.9719161298126, "f": 1200.0, "strategy_time": 0, "framework_time": 1.6380988527089357, "timestamp": "2023-04-17 11:59:27.937460+00:00"},
"1024,64,1024,1185": {"block_size_x": 1024, "nr_outer": 64, "nr_inner": 1024, "nvml_gr_clock": 1185, "core_freq": 1185.0, "time": 233.68294372558594, "times": [234.80934143066406, 233.49452209472656, 233.47506713867188, 233.58668518066406, 233.6378936767578, 233.54981994628906, 233.5590362548828, 233.58055114746094, 233.53549194335938, 233.6010284423828], "pwr_core_freq": 1185.0, "nvml_power": 98.846, "compile_time": 4087.922071106732, "verification_time": 0, "benchmark_time": 3914.0188968740404, "f": 1185.0, "strategy_time": 0, "framework_time": 1.6731258947402239, "timestamp": "2023-04-17 11:59:35.941117+00:00"},
"1024,64,1024,1170": {"block_size_x": 1024, "nr_outer": 64, "nr_inner": 1024, "nvml_gr_clock": 1170, "core_freq": 1170.0, "time": 236.27202606201172, "times": [235.86508178710938, 236.30950927734375, 236.39039611816406, 236.18048095703125, 236.4252166748047, 236.27264404296875, 236.32691955566406, 236.46514892578125, 236.32485961914062, 236.16000366210938], "pwr_core_freq": 1170.0, "nvml_power": 96.678, "compile_time": 4077.926717000082, "verification_time": 0, "benchmark_time": 3936.5763519890606, "f": 1170.0, "strategy_time": 0, "framework_time": 1.7853861209005117, "timestamp": "2023-04-17 11:59:43.957446+00:00"},
"1024,64,1024,1155": {"block_size_x": 1024, "nr_outer": 64, "nr_inner": 1024, "nvml_gr_clock": 1155, "core_freq": 1155.0, "time": 239.3185287475586, "times": [239.38047790527344, 239.47161865234375, 239.28627014160156, 239.17465209960938, 239.3385009765625, 239.46751403808594, 239.36614990234375, 239.45318603515625, 239.12550354003906, 239.1214141845703], "pwr_core_freq": 1155.0, "nvml_power": 95.806, "compile_time": 4096.007066080347, "verification_time": 0, "benchmark_time": 3990.271924994886, "f": 1155.0, "strategy_time": 0, "framework_time": 1.8212730064988136, "timestamp": "2023-04-17 11:59:52.045590+00:00"},
"1024,64,1024,1140": {"block_size_x": 1024, "nr_outer": 64, "nr_inner": 1024, "nvml_gr_clock": 1140, "core_freq": 1140.0, "time": 243.10599670410156, "times": [244.7605743408203, 242.92352294921875, 242.88768005371094, 242.87744140625, 242.8651580810547, 242.83340454101562, 243.0013427734375, 242.97573852539062, 242.988037109375, 242.9470672607422], "pwr_core_freq": 1140.0, "nvml_power": 93.376, "compile_time": 4082.202133955434, "verification_time": 0, "benchmark_time": 3997.0368649810553, "f": 1140.0, "strategy_time": 0, "framework_time": 1.6534391324967146, "timestamp": "2023-04-17 12:00:00.126529+00:00"},
"1024,64,1024,1125": {"block_size_x": 1024, "nr_outer": 64, "nr_inner": 1024, "nvml_gr_clock": 1125, "core_freq": 1125.0, "time": 246.16980438232423, "times": [246.2617645263672, 246.13375854492188, 246.0569610595703, 246.329345703125, 246.04159545898438, 246.15628051757812, 246.12454223632812, 246.19622802734375, 246.19418334960938, 246.20338439941406], "pwr_core_freq": 1125.0, "nvml_power": 91.207, "compile_time": 4144.700523931533, "verification_time": 0, "benchmark_time": 4100.48370109871, "f": 1125.0, "strategy_time": 0, "framework_time": 1.743437023833394, "timestamp": "2023-04-17 12:00:08.373497+00:00"},
"1024,64,1024,1110": {"block_size_x": 1024, "nr_outer": 64, "nr_inner": 1024, "nvml_gr_clock": 1110, "core_freq": 1110.0, "time": 249.54388275146485, "times": [249.7249298095703, 249.55596923828125, 249.51295471191406, 249.53240966796875, 249.45663452148438, 249.43411254882812, 249.63174438476562, 249.59896850585938, 249.45765686035156, 249.533447265625], "pwr_core_freq": 1110.0, "nvml_power": 89.066, "compile_time": 3996.8018559738994, "verification_time": 0, "benchmark_time": 4151.071417145431, "f": 1110.0, "strategy_time": 0, "framework_time": 1.414232887327671, "timestamp": "2023-04-17 12:00:16.522826+00:00"},
"1024,64,1024,1095": {"block_size_x": 1024, "nr_outer": 64, "nr_inner": 1024, "nvml_gr_clock": 1095, "core_freq": 1095.0, "time": 251.99462432861327, "times": [252.2572784423828, 251.7022705078125, 251.89170837402344, 251.95724487304688, 252.0668182373047, 251.96441650390625, 252.14259338378906, 251.9613494873047, 251.94598388671875, 252.05657958984375], "pwr_core_freq": 1095.0, "nvml_power": 87.323, "compile_time": 4100.673725828528, "verification_time": 0, "benchmark_time": 3932.452187873423, "f": 1095.0, "strategy_time": 0, "framework_time": 1.4113064389675856, "timestamp": "2023-04-17 12:00:24.557402+00:00"},
"1024,64,1024,1080": {"block_size_x": 1024, "nr_outer": 64, "nr_inner": 1024, "nvml_gr_clock": 1080, "core_freq": 1080.0, "time": 255.51380310058593, "times": [255.47264099121094, 255.52281188964844, 255.55661010742188, 255.3343963623047, 255.531005859375, 255.6538848876953, 255.6231689453125, 255.59347534179688, 255.42962646484375, 255.42041015625], "pwr_core_freq": 1080.0, "nvml_power": 85.274, "compile_time": 4102.47875819914, "verification_time": 0, "benchmark_time": 3986.680765869096, "f": 1080.0, "strategy_time": 0, "framework_time": 1.9051199778914452, "timestamp": "2023-04-17 12:00:32.648514+00:00"},
"1024,64,1024,1065": {"block_size_x": 1024, "nr_outer": 64, "nr_inner": 1024, "nvml_gr_clock": 1065, "core_freq": 1065.0, "time": 259.44586181640625, "times": [259.5143737792969, 259.3034362792969, 259.3249206542969, 259.55841064453125, 259.4314270019531, 259.3566589355469, 259.3433532714844, 259.462158203125, 259.6280212402344, 259.5358581542969], "pwr_core_freq": 1065.0, "nvml_power": 83.008, "compile_time": 4107.679956126958, "verification_time": 0, "benchmark_time": 4040.6263859476894, "f": 1065.0, "strategy_time": 0, "framework_time": 1.7111669294536114, "timestamp": "2023-04-17 12:00:40.798574+00:00"},
"1024,64,1024,1050": {"block_size_x": 1024, "nr_outer": 64, "nr_inner": 1024, "nvml_gr_clock": 1050, "core_freq": 1050.0, "time": 262.91619873046875, "times": [264.047607421875, 262.86285400390625, 262.7860412597656, 262.62322998046875, 262.8096008300781, 262.9621887207031, 262.7215270996094, 262.8700256347656, 262.6631774902344, 262.81573486328125], "pwr_core_freq": 1050.0, "nvml_power": 81.153, "compile_time": 4101.237880066037, "verification_time": 0, "benchmark_time": 4082.6625139452517, "f": 1050.0, "strategy_time": 0, "framework_time": 1.5952109824866056, "timestamp": "2023-04-17 12:00:48.984108+00:00"},
"1024,64,1024,1035": {"block_size_x": 1024, "nr_outer": 64, "nr_inner": 1024, "nvml_gr_clock": 1035, "core_freq": 1035.0, "time": 267.0746704101563, "times": [267.1769714355469, 267.156494140625, 267.0335998535156, 267.1759338378906, 266.8738708496094, 267.0612487792969, 267.1769714355469, 267.2230529785156, 266.83905029296875, 267.0295104980469], "pwr_core_freq": 1035.0, "nvml_power": 79.212, "compile_time": 4092.973619932309, "verification_time": 0, "benchmark_time": 4139.520436059684, "f": 1035.0, "strategy_time": 0, "framework_time": 1.8469500355422497, "timestamp": "2023-04-17 12:00:57.218494+00:00"},
"1024,64,1024,1020": {"block_size_x": 1024, "nr_outer": 64, "nr_inner": 1024, "nvml_gr_clock": 1020, "core_freq": 1020.0, "time": 269.8781768798828, "times": [270.0124206542969, 269.9028625488281, 269.8557434082031, 269.8291320800781, 269.86700439453125, 269.8383483886719, 269.9806823730469, 269.8188781738281, 269.8014831542969, 269.8752136230469], "pwr_core_freq": 1020.0, "nvml_power": 78.424, "compile_time": 4101.194989867508, "verification_time": 0, "benchmark_time": 4176.502882037312, "f": 1020.0, "strategy_time": 0, "framework_time": 1.8320530652999878, "timestamp": "2023-04-17 12:01:05.498063+00:00"},
"1024,64,1024,1005": {"block_size_x": 1024, "nr_outer": 64, "nr_inner": 1024, "nvml_gr_clock": 1005, "core_freq": 1005.0, "time": 273.9420196533203, "times": [274.1104736328125, 273.9660949707031, 273.87188720703125, 273.9742736816406, 273.9015808105469, 273.94354248046875, 274.0019226074219, 273.87493896484375, 273.902587890625, 273.8728942871094], "pwr_core_freq": 1005.0, "nvml_power": 77.732, "compile_time": 4100.453634979203, "verification_time": 0, "benchmark_time": 4242.117614950985, "f": 1005.0, "strategy_time": 0, "framework_time": 1.48286996409297, "timestamp": "2023-04-17 12:01:13.842155+00:00"},
"1024,64,1024,990": {"block_size_x": 1024, "nr_outer": 64, "nr_inner": 1024, "nvml_gr_clock": 990, "core_freq": 990.0, "time": 278.0705810546875, "times": [278.1327209472656, 278.0057678222656, 278.0682373046875, 278.1009826660156, 278.0334167480469, 278.0979309082031, 278.0415954589844, 278.108154296875, 278.07232666015625, 278.044677734375], "pwr_core_freq": 990.0, "nvml_power": 76.847, "compile_time": 4104.103885125369, "verification_time": 0, "benchmark_time": 4293.554617092013, "f": 990.0, "strategy_time": 0, "framework_time": 1.3940348289906979, "timestamp": "2023-04-17 12:01:22.241247+00:00"},
"1024,64,1024,975": {"block_size_x": 1024, "nr_outer": 64, "nr_inner": 1024, "nvml_gr_clock": 975, "core_freq": 975.0, "time": 282.3091186523437, "times": [282.345458984375, 282.2881164550781, 282.365966796875, 282.37310791015625, 282.2840270996094, 282.26763916015625, 282.33831787109375, 282.2789001464844, 282.2072448730469, 282.3424072265625], "pwr_core_freq": 975.0, "nvml_power": 76.362, "compile_time": 4102.318949997425, "verification_time": 0, "benchmark_time": 4354.748629964888, "f": 975.0, "strategy_time": 0, "framework_time": 1.5725181438028812, "timestamp": "2023-04-17 12:01:30.699928+00:00"},
"1024,64,1024,960": {"block_size_x": 1024, "nr_outer": 64, "nr_inner": 1024, "nvml_gr_clock": 960, "core_freq": 960.0, "time": 286.7182556152344, "times": [286.8295593261719, 286.6964416503906, 286.7425231933594, 286.73126220703125, 286.73944091796875, 286.7660827636719, 286.7240905761719, 286.6360168457031, 286.6954345703125, 286.6217041015625], "pwr_core_freq": 960.0, "nvml_power": 75.367, "compile_time": 4096.671518869698, "verification_time": 0, "benchmark_time": 4422.152234008536, "f": 960.0, "strategy_time": 0, "framework_time": 1.6961093060672283, "timestamp": "2023-04-17 12:01:39.220488+00:00"},
"1024,64,1024,945": {"block_size_x": 1024, "nr_outer": 64, "nr_inner": 1024, "nvml_gr_clock": 945, "core_freq": 945.0, "time": 291.2885772705078, "times": [291.378173828125, 291.3628234863281, 291.3034362792969, 291.2327575683594, 291.1825866699219, 291.3351745605469, 291.2706604003906, 291.2491455078125, 291.29522705078125, 291.2757873535156], "pwr_core_freq": 945.0, "nvml_power": 74.676, "compile_time": 4097.485037986189, "verification_time": 0, "benchmark_time": 4486.857026815414, "f": 945.0, "strategy_time": 0, "framework_time": 1.874422188848257, "timestamp": "2023-04-17 12:01:47.806745+00:00"},
"1024,64,1024,930": {"block_size_x": 1024, "nr_outer": 64, "nr_inner": 1024, "nvml_gr_clock": 930, "core_freq": 930.0, "time": 295.9819732666016, "times": [296.20428466796875, 295.9554443359375, 295.9185791015625, 295.9779968261719, 296.0025634765625, 295.952392578125, 295.8704528808594, 295.9810485839844, 295.94622802734375, 296.0107421875], "pwr_core_freq": 930.0, "nvml_power": 73.921, "compile_time": 4090.267041930929, "verification_time": 0, "benchmark_time": 4548.6033000051975, "f": 930.0, "strategy_time": 0, "framework_time": 1.646868884563446, "timestamp": "2023-04-17 12:01:56.447301+00:00"},
"1024,64,1024,915": {"block_size_x": 1024, "nr_outer": 64, "nr_inner": 1024, "nvml_gr_clock": 915, "core_freq": 915.0, "time": 300.8551910400391, "times": [300.8901062011719, 300.91058349609375, 300.9034118652344, 300.9013671875, 300.8563232421875, 300.8092041015625, 300.8409729003906, 300.8819274902344, 300.8174133300781, 300.7406005859375], "pwr_core_freq": 915.0, "nvml_power": 73.141, "compile_time": 4096.643695840612, "verification_time": 0, "benchmark_time": 4612.532663857564, "f": 915.0, "strategy_time": 0, "framework_time": 1.8637531902641058, "timestamp": "2023-04-17 12:02:05.158387+00:00"},
"1024,64,1024,900": {"block_size_x": 1024, "nr_outer": 64, "nr_inner": 1024, "nvml_gr_clock": 900, "core_freq": 900.0, "time": 305.8379760742188, "times": [305.99884033203125, 305.839111328125, 305.7991638183594, 305.78790283203125, 305.8278503417969, 305.7991638183594, 305.7950744628906, 305.8227233886719, 305.828857421875, 305.8810729980469], "pwr_core_freq": 900.0, "nvml_power": 72.462, "compile_time": 4096.892250003293, "verification_time": 0, "benchmark_time": 4685.973217943683, "f": 900.0, "strategy_time": 0, "framework_time": 1.9078762270510197, "timestamp": "2023-04-17 12:02:13.943202+00:00"},
"1024,64,1024,885": {"block_size_x": 1024, "nr_outer": 64, "nr_inner": 1024, "nvml_gr_clock": 885, "core_freq": 885.0, "time": 311.0253540039063, "times": [311.12908935546875, 310.9877624511719, 311.04718017578125, 311.0543212890625, 311.004150390625, 311.00927734375, 311.00006103515625, 311.04205322265625, 311.0256652832031, 310.9539794921875], "pwr_core_freq": 885.0, "nvml_power": 71.575, "compile_time": 4109.1789859347045, "verification_time": 0, "benchmark_time": 4746.403133030981, "f": 885.0, "strategy_time": 0, "framework_time": 1.2979749590158463, "timestamp": "2023-04-17 12:02:22.800122+00:00"},
"1024,64,1024,870": {"block_size_x": 1024, "nr_outer": 64, "nr_inner": 1024, "nvml_gr_clock": 870, "core_freq": 870.0, "time": 316.3597808837891, "times": [316.4375, 316.4252014160156, 316.2798156738281, 316.3576354980469, 316.442626953125, 316.2398681640625, 316.34124755859375, 316.37298583984375, 316.3115539550781, 316.3893737792969], "pwr_core_freq": 870.0, "nvml_power": 70.786, "compile_time": 4115.212951088324, "verification_time": 0, "benchmark_time": 4828.389092115685, "f": 870.0, "strategy_time": 0, "framework_time": 1.3830338139086962, "timestamp": "2023-04-17 12:02:31.745152+00:00"},
"1024,64,1024,855": {"block_size_x": 1024, "nr_outer": 64, "nr_inner": 1024, "nvml_gr_clock": 855, "core_freq": 855.0, "time": 321.95338439941406, "times": [322.1022644042969, 321.8677673339844, 322.0060119628906, 321.83294677734375, 322.0316162109375, 321.9630126953125, 321.9998779296875, 321.87188720703125, 321.9568786621094, 321.9015808105469], "pwr_core_freq": 855.0, "nvml_power": 70.095, "compile_time": 4100.919124903157, "verification_time": 0, "benchmark_time": 4906.773173017427, "f": 855.0, "strategy_time": 0, "framework_time": 1.529898028820753, "timestamp": "2023-04-17 12:02:40.754414+00:00"},
"1024,64,1024,840": {"block_size_x": 1024, "nr_outer": 64, "nr_inner": 1024, "nvml_gr_clock": 840, "core_freq": 840.0, "time": 327.69341430664065, "times": [327.8233642578125, 327.6882019042969, 327.6636047363281, 327.70458984375, 327.7055969238281, 327.6656494140625, 327.6195983886719, 327.7004699707031, 327.61651611328125, 327.7465515136719], "pwr_core_freq": 840.0, "nvml_power": 69.512, "compile_time": 4105.191617039964, "verification_time": 0, "benchmark_time": 4989.219421055168, "f": 840.0, "strategy_time": 0, "framework_time": 1.8621899653226137, "timestamp": "2023-04-17 12:02:49.850734+00:00"},
"1024,64,1024,825": {"block_size_x": 1024, "nr_outer": 64, "nr_inner": 1024, "nvml_gr_clock": 825, "core_freq": 825.0, "time": 333.6258575439453, "times": [333.73388671875, 333.5546875, 333.6488952636719, 333.5669860839844, 333.6519775390625, 333.6837158203125, 333.69189453125, 333.6151123046875, 333.5751647949219, 333.5362548828125], "pwr_core_freq": 825.0, "nvml_power": 68.82, "compile_time": 4096.488727023825, "verification_time": 0, "benchmark_time": 4718.427473912016, "f": 825.0, "strategy_time": 0, "framework_time": 1.710045151412487, "timestamp": "2023-04-17 12:02:58.667399+00:00"},
"1024,64,1024,810": {"block_size_x": 1024, "nr_outer": 64, "nr_inner": 1024, "nvml_gr_clock": 810, "core_freq": 810.0, "time": 339.8330383300781, "times": [339.989501953125, 339.79290771484375, 339.8399963378906, 339.8236083984375, 339.81951904296875, 339.7345275878906, 339.9239807128906, 339.7806091308594, 339.810302734375, 339.8154296875], "pwr_core_freq": 810.0, "nvml_power": 67.826, "compile_time": 4116.6339549236, "verification_time": 0, "benchmark_time": 4815.373395103961, "f": 810.0, "strategy_time": 0, "framework_time": 1.7956849187612534, "timestamp": "2023-04-17 12:03:07.601241+00:00"},
"1024,64,1024,795": {"block_size_x": 1024, "nr_outer": 64, "nr_inner": 1024, "nvml_gr_clock": 795, "core_freq": 795.0, "time": 346.235498046875, "times": [346.397705078125, 346.2318115234375, 346.2441101074219, 346.25537109375, 346.23077392578125, 346.2799377441406, 346.2062072753906, 346.2297668457031, 346.12017822265625, 346.15911865234375], "pwr_core_freq": 795.0, "nvml_power": 67.164, "compile_time": 4106.994616100565, "verification_time": 0, "benchmark_time": 4907.6839031185955, "f": 795.0, "strategy_time": 0, "framework_time": 1.8452578224241734, "timestamp": "2023-04-17 12:03:16.617806+00:00"},
"1024,64,1024,780": {"block_size_x": 1024, "nr_outer": 64, "nr_inner": 1024, "nvml_gr_clock": 780, "core_freq": 780.0, "time": 352.90777587890625, "times": [352.97076416015625, 352.8355712890625, 352.9308166503906, 352.9932861328125, 352.8796081542969, 352.88165283203125, 352.8386535644531, 352.9123840332031, 352.91546630859375, 352.9195556640625], "pwr_core_freq": 780.0, "nvml_power": 66.472, "compile_time": 4122.755753109232, "verification_time": 0, "benchmark_time": 4991.451141890138, "f": 780.0, "strategy_time": 0, "framework_time": 1.7560499254614115, "timestamp": "2023-04-17 12:03:25.733813+00:00"},
"1024,64,1024,765": {"block_size_x": 1024, "nr_outer": 64, "nr_inner": 1024, "nvml_gr_clock": 765, "core_freq": 765.0, "time": 359.84886169433594, "times": [359.97491455078125, 359.8674011230469, 359.9032287597656, 359.8622741699219, 359.8305358886719, 359.804931640625, 359.7885437011719, 359.7793273925781, 359.91552734375, 359.7619323730469], "pwr_core_freq": 765.0, "nvml_power": 65.878, "compile_time": 4101.836499059573, "verification_time": 0, "benchmark_time": 5058.8652461301535, "f": 765.0, "strategy_time": 0, "framework_time": 1.667593838647008, "timestamp": "2023-04-17 12:03:34.896220+00:00"},
"1024,64,1024,750": {"block_size_x": 1024, "nr_outer": 64, "nr_inner": 1024, "nvml_gr_clock": 750, "core_freq": 750.0, "time": 366.98377990722656, "times": [367.0333557128906, 366.9012451171875, 366.85516357421875, 366.99237060546875, 366.9862365722656, 366.99444580078125, 366.97088623046875, 367.0865783691406, 366.97393798828125, 367.0435791015625], "pwr_core_freq": 750.0, "nvml_power": 64.991, "compile_time": 4155.044510029256, "verification_time": 0, "benchmark_time": 5181.549855042249, "f": 750.0, "strategy_time": 0, "framework_time": 1.8032989464700222, "timestamp": "2023-04-17 12:03:44.234657+00:00"},
"1024,64,1024,735": {"block_size_x": 1024, "nr_outer": 64, "nr_inner": 1024, "nvml_gr_clock": 735, "core_freq": 735.0, "time": 374.47352294921876, "times": [374.6375732421875, 374.4583740234375, 374.3969421386719, 374.4849853515625, 374.4962463378906, 374.50445556640625, 374.50750732421875, 374.43377685546875, 374.4153747558594, 374.3999938964844], "pwr_core_freq": 735.0, "nvml_power": 64.33, "compile_time": 4162.422975990921, "verification_time": 0, "benchmark_time": 5276.2868870049715, "f": 735.0, "strategy_time": 0, "framework_time": 1.6642999835312366, "timestamp": "2023-04-17 12:03:53.675079+00:00"},
"1024,64,1024,720": {"block_size_x": 1024, "nr_outer": 64, "nr_inner": 1024, "nvml_gr_clock": 720, "core_freq": 720.0, "time": 382.29453125, "times": [382.3984680175781, 382.28173828125, 382.2704772949219, 382.11175537109375, 382.4711608886719, 382.2274475097656, 382.37286376953125, 382.2336120605469, 382.2243957519531, 382.3533935546875], "pwr_core_freq": 720.0, "nvml_power": 63.625, "compile_time": 4003.4591739531606, "verification_time": 0, "benchmark_time": 5377.064416883513, "f": 720.0, "strategy_time": 0, "framework_time": 1.5876672696322203, "timestamp": "2023-04-17 12:04:03.057229+00:00"},
"1024,64,1024,705": {"block_size_x": 1024, "nr_outer": 64, "nr_inner": 1024, "nvml_gr_clock": 705, "core_freq": 705.0, "time": 390.4415771484375, "times": [390.59149169921875, 390.3959045410156, 390.3969421386719, 390.4839782714844, 390.5157165527344, 390.4132995605469, 390.44403076171875, 390.45733642578125, 390.33447265625, 390.3825988769531], "pwr_core_freq": 705.0, "nvml_power": 63.024, "compile_time": 4097.357010003179, "verification_time": 0, "benchmark_time": 5477.075855014846, "f": 705.0, "strategy_time": 0, "framework_time": 1.846638973802328, "timestamp": "2023-04-17 12:04:12.633554+00:00"},
"1024,64,1024,690": {"block_size_x": 1024, "nr_outer": 64, "nr_inner": 1024, "nvml_gr_clock": 690, "core_freq": 690.0, "time": 398.97764282226564, "times": [399.2197265625, 398.93914794921875, 398.8715515136719, 399.0364074707031, 398.9227600097656, 399.1060485839844, 398.95245361328125, 398.97906494140625, 398.93914794921875, 398.81011962890625], "pwr_core_freq": 690.0, "nvml_power": 62.059, "compile_time": 4080.417089164257, "verification_time": 0, "benchmark_time": 5577.133127953857, "f": 690.0, "strategy_time": 0, "framework_time": 1.5065348707139492, "timestamp": "2023-04-17 12:04:22.292662+00:00"},
"1024,64,1024,675": {"block_size_x": 1024, "nr_outer": 64, "nr_inner": 1024, "nvml_gr_clock": 675, "core_freq": 675.0, "time": 407.7825073242187, "times": [407.83770751953125, 407.8182373046875, 407.8397521972656, 407.8602294921875, 407.7885437011719, 407.736328125, 407.7803649902344, 407.7250671386719, 407.8233642578125, 407.615478515625], "pwr_core_freq": 675.0, "nvml_power": 61.367, "compile_time": 4112.841350026429, "verification_time": 0, "benchmark_time": 5691.453820094466, "f": 675.0, "strategy_time": 0, "framework_time": 1.7225078772753477, "timestamp": "2023-04-17 12:04:32.098723+00:00"},
"1024,64,1024,660": {"block_size_x": 1024, "nr_outer": 64, "nr_inner": 1024, "nvml_gr_clock": 660, "core_freq": 660.0, "time": 417.06669921875, "times": [417.1376647949219, 417.0731506347656, 417.1151428222656, 417.04754638671875, 417.04754638671875, 417.04449462890625, 417.18170166015625, 416.9942932128906, 416.96868896484375, 417.0567626953125], "pwr_core_freq": 660.0, "nvml_power": 60.577, "compile_time": 4103.163717780262, "verification_time": 0, "benchmark_time": 5822.8831680025905, "f": 660.0, "strategy_time": 0, "framework_time": 1.7694663256406784, "timestamp": "2023-04-17 12:04:42.026587+00:00"},
"1024,64,1024,645": {"block_size_x": 1024, "nr_outer": 64, "nr_inner": 1024, "nvml_gr_clock": 645, "core_freq": 645.0, "time": 426.7692016601562, "times": [426.8636169433594, 426.7847595214844, 426.76837158203125, 426.7530212402344, 426.8062744140625, 426.703857421875, 426.83905029296875, 426.7950134277344, 426.6567687988281, 426.7212829589844], "pwr_core_freq": 645.0, "nvml_power": 59.804, "compile_time": 4105.457995086908, "verification_time": 0, "benchmark_time": 5948.781721992418, "f": 645.0, "strategy_time": 0, "framework_time": 1.9260288681834936, "timestamp": "2023-04-17 12:04:52.082793+00:00"},
"1024,64,1024,630": {"block_size_x": 1024, "nr_outer": 64, "nr_inner": 1024, "nvml_gr_clock": 630, "core_freq": 630.0, "time": 436.9007629394531, "times": [437.01861572265625, 436.78924560546875, 436.86810302734375, 436.9756164550781, 436.9827880859375, 436.8568420410156, 436.8670654296875, 436.7974548339844, 436.917236328125, 436.9346618652344], "pwr_core_freq": 630.0, "nvml_power": 59.222, "compile_time": 4104.4084338936955, "verification_time": 0, "benchmark_time": 6084.558471804485, "f": 630.0, "strategy_time": 0, "framework_time": 1.7570431809872389, "timestamp": "2023-04-17 12:05:02.273562+00:00"},
"1024,64,1024,615": {"block_size_x": 1024, "nr_outer": 64, "nr_inner": 1024, "nvml_gr_clock": 615, "core_freq": 615.0, "time": 447.58558349609376, "times": [447.6293029785156, 447.6067810058594, 447.5832214355469, 447.562744140625, 447.6344299316406, 447.71942138671875, 447.5074462890625, 447.5545654296875, 447.4808349609375, 447.57708740234375], "pwr_core_freq": 615.0, "nvml_power": 58.42, "compile_time": 4100.000568898395, "verification_time": 0, "benchmark_time": 6232.942117145285, "f": 615.0, "strategy_time": 0, "framework_time": 1.7652069218456745, "timestamp": "2023-04-17 12:05:12.608317+00:00"},
"1024,64,1024,600": {"block_size_x": 1024, "nr_outer": 64, "nr_inner": 1024, "nvml_gr_clock": 600, "core_freq": 600.0, "time": 458.7399108886719, "times": [458.8728332519531, 458.8503112792969, 458.57073974609375, 458.80523681640625, 458.7622375488281, 458.7110290527344, 458.76837158203125, 458.6700744628906, 458.6096496582031, 458.77862548828125], "pwr_core_freq": 600.0, "nvml_power": 57.739, "compile_time": 4092.3391941469163, "verification_time": 0, "benchmark_time": 6368.069153046235, "f": 600.0, "strategy_time": 0, "framework_time": 1.9199477974325418, "timestamp": "2023-04-17 12:05:23.070690+00:00"},
"1024,64,1024,585": {"block_size_x": 1024, "nr_outer": 64, "nr_inner": 1024, "nvml_gr_clock": 585, "core_freq": 585.0, "time": 470.51304931640624, "times": [470.61810302734375, 470.4849853515625, 470.3590393066406, 470.54132080078125, 470.5689697265625, 470.5474548339844, 470.51776123046875, 470.5587158203125, 470.43890380859375, 470.4952392578125], "pwr_core_freq": 585.0, "nvml_power": 57.144, "compile_time": 4104.536672821268, "verification_time": 0, "benchmark_time": 6598.230117000639, "f": 585.0, "strategy_time": 0, "framework_time": 1.540409168228507, "timestamp": "2023-04-17 12:05:33.775037+00:00"},
"1024,64,1024,570": {"block_size_x": 1024, "nr_outer": 64, "nr_inner": 1024, "nvml_gr_clock": 570, "core_freq": 570.0, "time": 482.9178894042969, "times": [482.9890441894531, 482.9962158203125, 482.8528747558594, 482.7750549316406, 482.8794860839844, 482.8958740234375, 482.8907470703125, 482.914306640625, 483.0320739746094, 482.9532165527344], "pwr_core_freq": 570.0, "nvml_power": 56.561, "compile_time": 4091.666527092457, "verification_time": 0, "benchmark_time": 6751.95742584765, "f": 570.0, "strategy_time": 0, "framework_time": 1.5657451003789902, "timestamp": "2023-04-17 12:05:44.620274+00:00"},
"1024,64,1024,555": {"block_size_x": 1024, "nr_outer": 64, "nr_inner": 1024, "nvml_gr_clock": 555, "core_freq": 555.0, "time": 495.98033752441404, "times": [496.13720703125, 496.03173828125, 496.05120849609375, 495.98974609375, 496.005126953125, 496.04608154296875, 495.8832702636719, 495.89862060546875, 495.8453674316406, 495.9150085449219], "pwr_core_freq": 555.0, "nvml_power": 55.857, "compile_time": 4094.6744771208614, "verification_time": 0, "benchmark_time": 6921.382783912122, "f": 555.0, "strategy_time": 0, "framework_time": 1.611130079254508, "timestamp": "2023-04-17 12:05:55.637982+00:00"},
"1024,64,1024,540": {"block_size_x": 1024, "nr_outer": 64, "nr_inner": 1024, "nvml_gr_clock": 540, "core_freq": 540.0, "time": 509.7501708984375, "times": [509.89056396484375, 509.71136474609375, 509.8557434082031, 509.8557434082031, 509.802490234375, 509.655029296875, 509.6048583984375, 509.67041015625, 509.92333984375, 509.53216552734375], "pwr_core_freq": 540.0, "nvml_power": 55.288, "compile_time": 4088.820690056309, "verification_time": 0, "benchmark_time": 6591.899810126051, "f": 540.0, "strategy_time": 0, "framework_time": 1.4867177233099937, "timestamp": "2023-04-17 12:06:06.320232+00:00"},
"1024,64,1024,525": {"block_size_x": 1024, "nr_outer": 64, "nr_inner": 1024, "nvml_gr_clock": 525, "core_freq": 525.0, "time": 524.3079650878906, "times": [524.2777709960938, 524.17431640625, 524.3811645507812, 524.33203125, 524.1866455078125, 524.3955078125, 524.1804809570312, 524.4415893554688, 524.3453369140625, 524.3648071289062], "pwr_core_freq": 525.0, "nvml_power": 54.596, "compile_time": 4095.486724982038, "verification_time": 0, "benchmark_time": 6755.548134911805, "f": 525.0, "strategy_time": 0, "framework_time": 2.026245230808854, "timestamp": "2023-04-17 12:06:17.173332+00:00"},
"1024,64,1024,510": {"block_size_x": 1024, "nr_outer": 64, "nr_inner": 1024, "nvml_gr_clock": 510, "core_freq": 510.0, "time": 539.6819946289063, "times": [539.8118286132812, 539.8446044921875, 539.7903442382812, 539.7125244140625, 539.5762939453125, 539.6223754882812, 539.6111450195312, 539.6244506835938, 539.6336669921875, 539.5927124023438], "pwr_core_freq": 510.0, "nvml_power": 53.918, "compile_time": 4081.193449907005, "verification_time": 0, "benchmark_time": 6941.0028711427, "f": 510.0, "strategy_time": 0, "framework_time": 1.8640230409801006, "timestamp": "2023-04-17 12:06:28.197432+00:00"},
"1024,64,1024,495": {"block_size_x": 1024, "nr_outer": 64, "nr_inner": 1024, "nvml_gr_clock": 495, "core_freq": 495.0, "time": 556.0240112304688, "times": [555.9449462890625, 556.2203979492188, 556.0565795898438, 556.0484008789062, 556.0012817382812, 556.084228515625, 556.0903930664062, 556.042236328125, 555.8886108398438, 555.863037109375], "pwr_core_freq": 495.0, "nvml_power": 53.322, "compile_time": 4105.074779130518, "verification_time": 0, "benchmark_time": 7144.874517107382, "f": 495.0, "strategy_time": 0, "framework_time": 1.6533387824892998, "timestamp": "2023-04-17 12:06:39.449074+00:00"},
"1024,64,1024,480": {"block_size_x": 1024, "nr_outer": 64, "nr_inner": 1024, "nvml_gr_clock": 480, "core_freq": 480.0, "time": 573.4587463378906, "times": [573.528076171875, 573.4819946289062, 573.412353515625, 573.5792846679688, 573.4052124023438, 573.3447875976562, 573.43896484375, 573.4676513671875, 573.5833740234375, 573.3457641601562], "pwr_core_freq": 480.0, "nvml_power": 52.641, "compile_time": 4092.5521918106824, "verification_time": 0, "benchmark_time": 7354.102766141295, "f": 480.0, "strategy_time": 0, "framework_time": 1.5675791073590517, "timestamp": "2023-04-17 12:06:50.897340+00:00"},
"1024,64,1024,465": {"block_size_x": 1024, "nr_outer": 64, "nr_inner": 1024, "nvml_gr_clock": 465, "core_freq": 465.0, "time": 591.9163513183594, "times": [592.0983276367188, 591.9641723632812, 591.9877319335938, 591.8699340820312, 591.9549560546875, 591.8402709960938, 591.8822631835938, 591.794189453125, 591.8709716796875, 591.9006958007812], "pwr_core_freq": 465.0, "nvml_power": 52.046, "compile_time": 4120.490039000288, "verification_time": 0, "benchmark_time": 7571.319403825328, "f": 465.0, "strategy_time": 0, "framework_time": 1.7648970242589712, "timestamp": "2023-04-17 12:07:02.590954+00:00"},
"1024,64,1024,450": {"block_size_x": 1024, "nr_outer": 64, "nr_inner": 1024, "nvml_gr_clock": 450, "core_freq": 450.0, "time": 611.679736328125, "times": [611.87890625, 611.689453125, 611.6566772460938, 611.6239624023438, 611.472412109375, 611.5286865234375, 611.6669311523438, 611.9096069335938, 611.7181396484375, 611.652587890625], "pwr_core_freq": 450.0, "nvml_power": 51.45, "compile_time": 4097.408221103251, "verification_time": 0, "benchmark_time": 7814.1513098962605, "f": 450.0, "strategy_time": 0, "framework_time": 1.6369980294257402, "timestamp": "2023-04-17 12:07:14.504190+00:00"},
"1024,64,1024,435": {"block_size_x": 1024, "nr_outer": 64, "nr_inner": 1024, "nvml_gr_clock": 435, "core_freq": 435.0, "time": 632.7418823242188, "times": [632.8514404296875, 632.7941284179688, 632.7449340820312, 632.7347412109375, 632.8319702148438, 632.6405029296875, 632.7992553710938, 632.8883056640625, 632.4572143554688, 632.6763305664062], "pwr_core_freq": 435.0, "nvml_power": 50.854, "compile_time": 4109.495535958558, "verification_time": 0, "benchmark_time": 8060.727220028639, "f": 435.0, "strategy_time": 0, "framework_time": 1.8542460165917873, "timestamp": "2023-04-17 12:07:26.676306+00:00"},
"1024,64,1024,420": {"block_size_x": 1024, "nr_outer": 64, "nr_inner": 1024, "nvml_gr_clock": 420, "core_freq": 420.0, "time": 655.3425903320312, "times": [655.37841796875, 655.405029296875, 655.3211059570312, 655.1367797851562, 655.2156372070312, 655.3794555664062, 655.4603271484375, 655.4142456054688, 655.2371215820312, 655.477783203125], "pwr_core_freq": 420.0, "nvml_power": 50.174, "compile_time": 4113.070155028254, "verification_time": 0, "benchmark_time": 8280.865965178236, "f": 420.0, "strategy_time": 0, "framework_time": 1.4582546427845955, "timestamp": "2023-04-17 12:07:39.071742+00:00"},
"1024,64,1024,405": {"block_size_x": 1024, "nr_outer": 64, "nr_inner": 1024, "nvml_gr_clock": 405, "core_freq": 405.0, "time": 679.5914184570313, "times": [679.773193359375, 679.4669799804688, 679.751708984375, 679.5274047851562, 679.5693969726562, 679.678955078125, 679.6615600585938, 679.3236694335938, 679.6277465820312, 679.5335693359375], "pwr_core_freq": 405.0, "nvml_power": 49.591, "compile_time": 4105.702388798818, "verification_time": 0, "benchmark_time": 8619.045936036855, "f": 405.0, "strategy_time": 0, "framework_time": 1.7024013213813305, "timestamp": "2023-04-17 12:07:51.798232+00:00"},
"1024,64,1024,390": {"block_size_x": 1024, "nr_outer": 64, "nr_inner": 1024, "nvml_gr_clock": 390, "core_freq": 390.0, "time": 705.7730590820313, "times": [705.82373046875, 705.5554809570312, 705.9630126953125, 705.6803588867188, 705.6987915039062, 705.8165893554688, 705.8258056640625, 705.67529296875, 705.8268432617188, 705.8646850585938], "pwr_core_freq": 390.0, "nvml_power": 48.982, "compile_time": 4105.285950936377, "verification_time": 0, "benchmark_time": 8926.802532048896, "f": 390.0, "strategy_time": 0, "framework_time": 1.6940250061452389, "timestamp": "2023-04-17 12:08:04.832060+00:00"},
"1024,64,1024,375": {"block_size_x": 1024, "nr_outer": 64, "nr_inner": 1024, "nvml_gr_clock": 375, "core_freq": 375.0, "time": 733.9898986816406, "times": [734.1987915039062, 734.1220092773438, 733.93359375, 733.81787109375, 733.960205078125, 733.9049072265625, 733.9735107421875, 733.9888916015625, 733.90283203125, 734.0963745117188], "pwr_core_freq": 375.0, "nvml_power": 48.289, "compile_time": 4092.875603120774, "verification_time": 0, "benchmark_time": 9277.958148159087, "f": 375.0, "strategy_time": 0, "framework_time": 1.6950967255979776, "timestamp": "2023-04-17 12:08:18.204628+00:00"},
"1024,64,1024,360": {"block_size_x": 1024, "nr_outer": 64, "nr_inner": 1024, "nvml_gr_clock": 360, "core_freq": 360.0, "time": 764.5572143554688, "times": [764.663818359375, 764.6136474609375, 764.5982666015625, 764.3248901367188, 764.4600219726562, 764.5409545898438, 764.6617431640625, 764.3648071289062, 764.5757446289062, 764.7682495117188], "pwr_core_freq": 360.0, "nvml_power": 47.719, "compile_time": 4086.3142129965127, "verification_time": 0, "benchmark_time": 9641.185149084777, "f": 360.0, "strategy_time": 0, "framework_time": 1.4782517682760954, "timestamp": "2023-04-17 12:08:31.933651+00:00"},
"1024,64,1024,345": {"block_size_x": 1024, "nr_outer": 64, "nr_inner": 1024, "nvml_gr_clock": 345, "core_freq": 345.0, "time": 797.8248168945313, "times": [797.9110107421875, 797.69189453125, 797.83935546875, 797.5219116210938, 797.8567504882812, 797.9694213867188, 797.9428100585938, 798.0482788085938, 797.7379760742188, 797.728759765625], "pwr_core_freq": 345.0, "nvml_power": 47.123, "compile_time": 4078.505452023819, "verification_time": 0, "benchmark_time": 10018.082062946633, "f": 345.0, "strategy_time": 0, "framework_time": 1.4606090262532234, "timestamp": "2023-04-17 12:08:46.031736+00:00"},
"1024,64,1024,330": {"block_size_x": 1024, "nr_outer": 64, "nr_inner": 1024, "nvml_gr_clock": 330, "core_freq": 330.0, "time": 834.1118957519532, "times": [834.460693359375, 833.850341796875, 834.1268310546875, 834.0316162109375, 834.2251586914062, 834.1248168945312, 834.0162353515625, 834.2650756835938, 833.9957885742188, 834.0223999023438], "pwr_core_freq": 330.0, "nvml_power": 46.539, "compile_time": 4104.901912854984, "verification_time": 0, "benchmark_time": 10486.657785018906, "f": 330.0, "strategy_time": 0, "framework_time": 1.4825211837887764, "timestamp": "2023-04-17 12:09:00.624819+00:00"},
"1024,64,1024,315": {"block_size_x": 1024, "nr_outer": 64, "nr_inner": 1024, "nvml_gr_clock": 315, "core_freq": 315.0, "time": 873.7278869628906, "times": [873.9542846679688, 873.660400390625, 874.013671875, 873.3746948242188, 873.5405883789062, 873.839599609375, 873.796630859375, 873.7167358398438, 873.8355102539062, 873.5467529296875], "pwr_core_freq": 315.0, "nvml_power": 45.864, "compile_time": 4090.024786069989, "verification_time": 0, "benchmark_time": 10957.504651043564, "f": 315.0, "strategy_time": 0, "framework_time": 1.7062579281628132, "timestamp": "2023-04-17 12:09:15.674097+00:00"},
"1024,64,1024,300": {"block_size_x": 1024, "nr_outer": 64, "nr_inner": 1024, "nvml_gr_clock": 300, "core_freq": 300.0, "time": 917.4612976074219, "times": [917.381103515625, 917.4415283203125, 917.454833984375, 917.5531616210938, 917.4537963867188, 917.7149658203125, 917.4466552734375, 917.2991943359375, 917.3319702148438, 917.5357666015625], "pwr_core_freq": 300.0, "nvml_power": 45.262, "compile_time": 4096.029324922711, "verification_time": 0, "benchmark_time": 11474.07133411616, "f": 300.0, "strategy_time": 0, "framework_time": 1.9767738413065672, "timestamp": "2023-04-17 12:09:31.246220+00:00"},
"1024,64,1024,285": {"block_size_x": 1024, "nr_outer": 64, "nr_inner": 1024, "nvml_gr_clock": 285, "core_freq": 285.0, "time": 965.779248046875, "times": [965.9146118164062, 965.7886962890625, 965.7036743164062, 965.712890625, 965.9053955078125, 965.718017578125, 965.5746459960938, 965.823486328125, 965.8245239257812, 965.8265380859375], "pwr_core_freq": 285.0, "nvml_power": 44.581, "compile_time": 4078.020957065746, "verification_time": 0, "benchmark_time": 12057.846835115924, "f": 285.0, "strategy_time": 0, "framework_time": 1.8586418591439724, "timestamp": "2023-04-17 12:09:47.383985+00:00"},
"1024,64,1024,270": {"block_size_x": 1024, "nr_outer": 64, "nr_inner": 1024, "nvml_gr_clock": 270, "core_freq": 270.0, "time": 1019.3949768066407, "times": [1019.4002075195312, 1019.7596435546875, 1019.451416015625, 1019.3449096679688, 1019.3438720703125, 1019.2332763671875, 1019.5670776367188, 1019.2066650390625, 1019.2384033203125, 1019.404296875], "pwr_core_freq": 270.0, "nvml_power": 43.978, "compile_time": 4119.795963866636, "verification_time": 0, "benchmark_time": 11680.379966972396, "f": 270.0, "strategy_time": 0, "framework_time": 1.7269272357225418, "timestamp": "2023-04-17 12:10:03.185929+00:00"},
"1024,64,1024,255": {"block_size_x": 1024, "nr_outer": 64, "nr_inner": 1024, "nvml_gr_clock": 255, "core_freq": 255.0, "time": 1079.3212890625, "times": [1079.8397216796875, 1079.394287109375, 1079.43115234375, 1079.61962890625, 1079.3389892578125, 1079.1392822265625, 1079.17822265625, 1079.2059326171875, 1078.9775390625, 1079.088134765625], "pwr_core_freq": 255.0, "nvml_power": 43.297, "compile_time": 4121.330750873312, "verification_time": 0, "benchmark_time": 12348.103332798928, "f": 255.0, "strategy_time": 0, "framework_time": 1.846469473093748, "timestamp": "2023-04-17 12:10:19.657259+00:00"},
"1024,64,1024,240": {"block_size_x": 1024, "nr_outer": 64, "nr_inner": 1024, "nvml_gr_clock": 240, "core_freq": 240.0, "time": 1146.7887451171875, "times": [1146.925048828125, 1147.0704345703125, 1146.5174560546875, 1146.744873046875, 1146.71923828125, 1146.503173828125, 1146.852294921875, 1147.115478515625, 1146.5902099609375, 1146.8492431640625], "pwr_core_freq": 240.0, "nvml_power": 42.701, "compile_time": 4099.596650106832, "verification_time": 0, "benchmark_time": 13084.917892934754, "f": 240.0, "strategy_time": 0, "framework_time": 1.8411411438137293, "timestamp": "2023-04-17 12:10:36.843654+00:00"},
"1024,64,1024,225": {"block_size_x": 1024, "nr_outer": 64, "nr_inner": 1024, "nvml_gr_clock": 225, "core_freq": 225.0, "time": 1223.1791625976562, "times": [1223.0338134765625, 1223.1229248046875, 1223.3492431640625, 1223.13525390625, 1223.22021484375, 1223.099365234375, 1223.0164794921875, 1223.208984375, 1223.3226318359375, 1223.28271484375], "pwr_core_freq": 225.0, "nvml_power": 42.099, "compile_time": 4071.195452939719, "verification_time": 0, "benchmark_time": 13932.507635094225, "f": 225.0, "strategy_time": 0, "framework_time": 1.588498940691352, "timestamp": "2023-04-17 12:10:54.848987+00:00"},
"1024,64,1024,210": {"block_size_x": 1024, "nr_outer": 64, "nr_inner": 1024, "nvml_gr_clock": 210, "core_freq": 210.0, "time": 1310.694287109375, "times": [1311.1756591796875, 1310.6646728515625, 1310.77734375, 1310.1844482421875, 1311.035400390625, 1310.5386962890625, 1310.4752197265625, 1310.6524658203125, 1310.7108154296875, 1310.7281494140625], "pwr_core_freq": 210.0, "nvml_power": 41.413, "compile_time": 4120.7106618676335, "verification_time": 0, "benchmark_time": 14899.321283912286, "f": 210.0, "strategy_time": 0, "framework_time": 2.0944431889802217, "timestamp": "2023-04-17 12:11:13.871157+00:00"}}
}